[
  {
    "id": "vid-GbKM1g_H56M",
    "publishedDate": "2026-10-28",
    "format": "short",
    "links": {
      "youtube": "https://youtube.com/shorts/GbKM1g_H56M",
      "instagram": "https://www.instagram.com/reel/DfDMG9vNC4z/?dlrf=MWNsOTYzdXJpZjRnaw=="
    },
    "coverImageUrl": "/videos/FirstPlayableBuild.webp",
    "tags": [],
    "translations": {
      "en": {
        "title": "First Playable Build"
      },
      "fa": {
        "title": "وقتی بازی کار می‌کنه"
      }
    }
  },
  {
    "id": "vid-buJv2iaZQ2Q",
    "publishedDate": "2026-10-26",
    "format": "short",
    "links": {
      "youtube": "https://youtube.com/shorts/buJv2iaZQ2Q",
      "instagram": "https://www.instagram.com/reel/De9j1SONAZh/"
    },
    "coverImageUrl": "/videos/introduction.webp",
    "tags": [],
    "translations": {
      "en": {
        "title": "Introduction"
      },
      "fa": {
        "title": "معرفی"
      }
    }
  },
  {
    "id": "vid-Gps0f75wtjk",
    "publishedDate": "2026-06-30",
    "format": "video",
    "links": {
      "youtube": "https://youtu.be/Gps0f75wtjk"
    },
    "tags": [],
    "translations": {
      "en": {
        "title": "🎙 Behind The Build #01 | The Story of Wild Guest List"
      },
      "fa": {
        "title": "🎙 Behind The Build #01 | The Story of Wild Guest List"
      }
    }
  }
]
